metric_code,metric_name_vi,metric_name_en,definition_vi,entity_level,unit,window,k_level,formula_id,source_tables,source_events,dimensions,thresholds_ref,kill_switch,drilldown_keys,notes
verified_house_id_count,verified_house_id_count,verified_house_id_count,Số House_ID đạt trạng thái qualified (đủ điều kiện) trong kỳ.,mixed,count,point-in-time,K0,F-K0-02,event_log/house_master,,"commune_id,product_code,cluster_id",,False,"house_id,lead_id,job_id,txn_id",warn if off plan
war_room_decision_time_minutes,Thời gian ra quyết định War-room (phút),War-room decision time (minutes),Thời gian từ khi trigger RED đến khi quyết định hành động được log.,incident_id,minutes,90d,K6,F-SYS-PH-01,incident_log,"EVT_KILL_SWITCH_TRIGGERED,EVT_WARROOM_DECISION_LOGGED",tier,threshold_registry,True,"incident_id,event_id",PLACEHOLDER (incident SLA)
product_gate_reject_rate,Tỷ lệ Product Gate reject,Product Gate reject rate,Tỷ lệ hạng mục/đơn bị Product Gate từ chối do thiếu tiêu chuẩn sản phẩm (spec chưa đạt).,job_id/product_code,rate,7d,K7,F-K7-PH-01,product_gate_log,"EVT_PG_CHECK_FAILED,EVT_PG_CHECK_PASSED","commune_id,product_code",TBD,False,"job_id,house_id,event_id",PLACEHOLDER (chưa có event/nguồn trong pilot hiện tại).
product_gate_cycle_time_hours,Thời gian vòng đời Product Gate (giờ),Product Gate cycle time (hours),Thời gian từ lúc submit kiểm định Product Gate đến lúc pass/reject cuối cùng.,job_id/product_code,hours,30d,K7,F-K7-PH-02,product_gate_log,"EVT_PG_SUBMITTED,EVT_PG_CHECK_FAILED,EVT_PG_CHECK_PASSED","commune_id,product_code",TBD,False,"job_id,house_id,event_id",PLACEHOLDER.
product_defect_rate_post_handover,Tỷ lệ lỗi sản phẩm sau bàn giao,Post-handover product defect rate,Tỷ lệ job phát sinh lỗi sản phẩm trong window sau khi bàn giao (warranty/defect).,job_id/product_code,rate,30d,K7,F-K7-PH-03,warranty_log/complaint_log,"EVT_WARRANTY_OPENED,EVT_WARRANTY_CLOSED","commune_id,product_code,defect_type",TBD,False,"job_id,house_id,complaint_id,event_id",PLACEHOLDER; nếu vượt ngưỡng có thể nâng lên KILL-SWITCH ở pha scale.
